{
  "generated_at": "2026-07-23T03:05:40Z",
  "lanes": [
    {
      "blocking_gates": [],
      "commands_executed": [],
      "created_at": "2026-07-23T03:05:09Z",
      "data": {
        "capabilities": {
          "modules": {
            "jsonschema": true,
            "openpyxl": true,
            "pytest": true,
            "serial": false,
            "yaml": true
          },
          "platform": {
            "machine": "x86_64",
            "release": "6.12.13",
            "system": "Linux"
          },
          "python": {
            "available": true,
            "executable": "/opt/pyvenv/bin/python3",
            "version": "3.13.5"
          },
          "repo_root": "/mnt/data/bbws_v015_work/best_buds_cultivator_weight_station_v0_1_5",
          "serial_port_probe_error": null,
          "serial_ports": [],
          "tools": {
            "arduino_cli": {
              "available": false,
              "path": null,
              "version": null
            },
            "dpkg_deb": {
              "available": true,
              "exit_code": 0,
              "path": "/usr/bin/dpkg-deb",
              "version": "Debian 'dpkg-deb' package archive backend version 1.22.22 (amd64)."
            },
            "git": {
              "available": true,
              "exit_code": 0,
              "path": "/usr/bin/git",
              "version": "git version 2.47.3"
            }
          }
        },
        "drift": {
          "issues": [],
          "status": "clean",
          "version": "0.1.5"
        },
        "graph": {
          "graph_version": "1.1.0",
          "lanes": [
            {
              "lane": "repository-inspection",
              "requires": []
            },
            {
              "lane": "development-hygiene",
              "requires": [
                "repository-inspection"
              ]
            },
            {
              "lane": "software",
              "requires": [
                "development-hygiene"
              ]
            },
            {
              "lane": "agent-entrypoint",
              "requires": [
                "software"
              ]
            },
            {
              "lane": "software-dry-run",
              "requires": [
                "agent-entrypoint"
              ]
            },
            {
              "lane": "recovery-matrix",
              "requires": [
                "software-dry-run"
              ]
            },
            {
              "lane": "frontend-smoke",
              "requires": [
                "recovery-matrix"
              ]
            },
            {
              "lane": "packaging-preflight",
              "requires": [
                "frontend-smoke"
              ]
            },
            {
              "lane": "firmware",
              "requires": [
                "packaging-preflight"
              ]
            },
            {
              "lane": "serial",
              "requires": [
                "firmware"
              ]
            },
            {
              "lane": "zero-tare",
              "requires": [
                "serial"
              ]
            },
            {
              "lane": "calibration",
              "requires": [
                "zero-tare"
              ]
            },
            {
              "lane": "physical-loop",
              "requires": [
                "calibration"
              ]
            },
            {
              "lane": "release-packaging",
              "requires": [
                "physical-loop"
              ]
            }
          ],
          "package_version": "0.1.5"
        },
        "version": "0.1.5"
      },
      "evidence_refs": [],
      "lane": "repository-inspection",
      "next_action": null,
      "profile": "prehardware",
      "reason_code": "REPOSITORY_INSPECTED",
      "required_action": null,
      "status": "PASS",
      "warnings": []
    },
    {
      "blocking_gates": [],
      "commands_executed": [],
      "created_at": "2026-07-23T03:05:09Z",
      "data": {
        "generated_at": "2026-07-23T03:05:09Z",
        "lanes": [],
        "profile": "prehardware",
        "repairs": [],
        "status": "PASS",
        "version": "0.1.5",
        "warnings": []
      },
      "evidence_refs": [],
      "lane": "development-hygiene",
      "next_action": null,
      "profile": "prehardware",
      "reason_code": "SAFE_DRIFT_PREPARED",
      "required_action": null,
      "status": "PASS",
      "warnings": []
    },
    {
      "blocking_gates": [],
      "commands_executed": [
        {
          "command": [
            "/opt/pyvenv/bin/python3",
            "-m",
            "pytest",
            "-q",
            "-p",
            "no:cacheprovider"
          ],
          "duration_seconds": 6.236,
          "exit_code": 0,
          "stderr": "",
          "stdout": "........................................................................ [ 45%]\n........................................................................ [ 90%]\n...............                                                          [100%]\n"
        },
        {
          "command": [
            "/opt/pyvenv/bin/python3",
            "scripts/validate_repo.py"
          ],
          "duration_seconds": 11.753,
          "exit_code": 0,
          "stderr": "",
          "stdout": "{\n  \"checks\": {\n    \"claim_boundaries\": \"bounded\",\n    \"context_alignment\": {\n      \"events\": 58,\n      \"latest\": 58\n    },\n    \"forbidden_detached_paths\": \"absent\",\n    \"json_parse\": 234,\n    \"jsonl_parse\": 60,\n    \"llm_harness\": {\n      \"firmware\": \"BLOCKED\",\n      \"inspect\": \"pass\",\n      \"prepare\": \"PASS\",\n      \"software_dry_run\": \"SIMULATOR_PASS\"\n    },\n    \"manifest_hashes\": 502,\n    \"prior_state_preserved\": 6,\n    \"python_compile_import\": {\n      \"bootstrap\": \"AgentBootstrap\",\n      \"harness\": \"ValidationHarness\"\n    },\n    \"required_paths\": 29,\n    \"schemas\": 51,\n    \"test_suite\": 159,\n    \"version_alignment\": \"0.1.5\",\n    \"yaml_parse\": 1\n  },\n  \"errors\": [],\n  \"status\": \"pass\",\n  \"version\": \"0.1.5\"\n}\n"
        }
      ],
      "created_at": "2026-07-23T03:05:27Z",
      "data": {},
      "evidence_refs": [],
      "lane": "software",
      "next_action": null,
      "profile": "prehardware",
      "reason_code": "SOFTWARE_VALIDATION_PASSED",
      "required_action": null,
      "status": "PASS",
      "warnings": []
    },
    {
      "blocking_gates": [],
      "commands_executed": [
        {
          "command": [
            "/opt/pyvenv/bin/python3",
            "-m",
            "best_buds_weight_station.bootstrap",
            "--version"
          ],
          "duration_seconds": 0.52,
          "exit_code": 0,
          "stderr": "",
          "stdout": "0.1.5\n"
        },
        {
          "command": [
            "/opt/pyvenv/bin/python3",
            "-m",
            "best_buds_weight_station.bootstrap",
            "--help"
          ],
          "duration_seconds": 0.512,
          "exit_code": 0,
          "stderr": "",
          "stdout": "usage: best-buds-weight-station-bootstrap [-h] [--repo-root REPO_ROOT]\n                                          [--profile {development,prehardware}]\n                                          [--run-id RUN_ID] [--skip-ui]\n                                          [--no-persist] [--output OUTPUT]\n                                          [--version]\n\nRun the software-only prehardware validation bootstrap for coding agents.\n\noptions:\n  -h, --help            show this help message and exit\n  --repo-root REPO_ROOT\n  --profile {development,prehardware}\n  --run-id RUN_ID\n  --skip-ui\n  --no-persist\n  --output OUTPUT\n  --version\n"
        },
        {
          "command": [
            "/opt/pyvenv/bin/python3",
            "-m",
            "best_buds_weight_station.validation",
            "graph"
          ],
          "duration_seconds": 0.511,
          "exit_code": 0,
          "stderr": "",
          "stdout": "{\n  \"graph_version\": \"1.1.0\",\n  \"lanes\": [\n    {\n      \"lane\": \"repository-inspection\",\n      \"requires\": []\n    },\n    {\n      \"lane\": \"development-hygiene\",\n      \"requires\": [\n        \"repository-inspection\"\n      ]\n    },\n    {\n      \"lane\": \"software\",\n      \"requires\": [\n        \"development-hygiene\"\n      ]\n    },\n    {\n      \"lane\": \"agent-entrypoint\",\n      \"requires\": [\n        \"software\"\n      ]\n    },\n    {\n      \"lane\": \"software-dry-run\",\n      \"requires\": [\n        \"agent-entrypoint\"\n      ]\n    },\n    {\n      \"lane\": \"recovery-matrix\",\n      \"requires\": [\n        \"software-dry-run\"\n      ]\n    },\n    {\n      \"lane\": \"frontend-smoke\",\n      \"requires\": [\n        \"recovery-matrix\"\n      ]\n    },\n    {\n      \"lane\": \"packaging-preflight\",\n      \"requires\": [\n        \"frontend-smoke\"\n      ]\n    },\n    {\n      \"lane\": \"firmware\",\n      \"requires\": [\n        \"packaging-preflight\"\n      ]\n    },\n    {\n      \"lane\": \"serial\",\n      \"requires\": [\n        \"firmware\"\n      ]\n    },\n    {\n      \"lane\": \"zero-tare\",\n      \"requires\": [\n        \"serial\"\n      ]\n    },\n    {\n      \"lane\": \"calibration\",\n      \"requires\": [\n        \"zero-tare\"\n      ]\n    },\n    {\n      \"lane\": \"physical-loop\",\n      \"requires\": [\n        \"calibration\"\n      ]\n    },\n    {\n      \"lane\": \"release-packaging\",\n      \"requires\": [\n        \"physical-loop\"\n      ]\n    }\n  ],\n  \"package_version\": \"0.1.5\"\n}\n"
        }
      ],
      "created_at": "2026-07-23T03:05:29Z",
      "data": {
        "console_entrypoint": "best-buds-weight-station-bootstrap",
        "module_entrypoint": "python -m best_buds_weight_station.bootstrap"
      },